{
  "$schema": "https://ui.shadcn.com/schema/registry-item.json",
  "name": "button",
  "type": "registry:ui",
  "title": "Button",
  "description": "Button component built on Radix UI Slot (with asChild support)",
  "dependencies": [
    "@radix-ui/react-slot",
    "class-variance-authority",
    "clsx",
    "tailwind-merge"
  ],
  "registryDependencies": [],
  "files": [
    {
      "path": "registry/uxio/overrides-button-radix/button.tsx",
      "content": "import * as React from \"react\"\nimport { Slot } from \"@radix-ui/react-slot\"\nimport { cva, type VariantProps } from \"class-variance-authority\"\n\nimport { cn } from \"@/lib/utils\"\n\nconst buttonVariants = cva(\n  \"focus-visible:border-ring focus-visible:ring-ring/30 aria-invalid:ring-destructive/20 dark:aria-invalid:ring-destructive/40 aria-invalid:border-destructive dark:aria-invalid:border-destructive/50 rounded-md border border-transparent bg-clip-padding text-xs/relaxed font-medium focus-visible:ring-2 aria-invalid:ring-2 active:translate-y-px group/button inline-flex shrink-0 items-center justify-center whitespace-nowrap transition-all outline-none select-none disabled:pointer-events-none disabled:opacity-50 [&_svg]:pointer-events-none [&_svg]:shrink-0 [&_svg:not([class*='size-'])]:size-4\",\n  {\n    variants: {\n      variant: {\n        default: \"bg-primary text-primary-foreground hover:bg-primary/80\",\n        outline: \"border-border dark:bg-input/30 hover:bg-input/50 hover:text-foreground aria-expanded:bg-muted aria-expanded:text-foreground\",\n        secondary: \"bg-secondary text-secondary-foreground hover:bg-secondary/80 aria-expanded:bg-secondary aria-expanded:text-secondary-foreground\",\n        ghost: \"hover:bg-muted hover:text-foreground dark:hover:bg-muted/50 aria-expanded:bg-muted aria-expanded:text-foreground\",\n        destructive: \"bg-destructive/10 hover:bg-destructive/20 focus-visible:ring-destructive/20 dark:focus-visible:ring-destructive/40 dark:bg-destructive/20 text-destructive focus-visible:border-destructive/40 dark:hover:bg-destructive/30\",\n        link: \"text-primary underline-offset-4 hover:underline\",\n      },\n      size: {\n        default: \"h-7 gap-1 px-2 text-xs/relaxed has-data-[icon=inline-end]:pr-1.5 has-data-[icon=inline-start]:pl-1.5 [&_svg:not([class*='size-'])]:size-3.5\",\n        xs: \"h-5 gap-1 rounded-sm px-2 text-[0.625rem] has-data-[icon=inline-end]:pr-1.5 has-data-[icon=inline-start]:pl-1.5 [&_svg:not([class*='size-'])]:size-2.5\",\n        sm: \"h-6 gap-1 px-2 text-xs/relaxed has-data-[icon=inline-end]:pr-1.5 has-data-[icon=inline-start]:pl-1.5 [&_svg:not([class*='size-'])]:size-3\",\n        lg: \"h-8 gap-1 px-2.5 text-xs/relaxed has-data-[icon=inline-end]:pr-2 has-data-[icon=inline-start]:pl-2 [&_svg:not([class*='size-'])]:size-4\",\n        icon: \"size-7 [&_svg:not([class*='size-'])]:size-3.5\",\n        \"icon-xs\": \"size-5 rounded-sm [&_svg:not([class*='size-'])]:size-2.5\",\n        \"icon-sm\": \"size-6 [&_svg:not([class*='size-'])]:size-3\",\n        \"icon-lg\": \"size-8 [&_svg:not([class*='size-'])]:size-4\",\n      },\n    },\n    defaultVariants: {\n      variant: \"default\",\n      size: \"default\",\n    },\n  },\n)\n\nfunction Button({\n  className,\n  variant = \"default\",\n  size = \"default\",\n  asChild = false,\n  ...props\n}: React.ComponentProps<\"button\"> &\n  VariantProps<typeof buttonVariants> & {\n    asChild?: boolean\n  }) {\n  const Comp = asChild ? Slot : \"button\"\n  return (\n    <Comp\n      data-slot=\"button\"\n      className={cn(buttonVariants({ variant, size, className }))}\n      {...props}\n    />\n  )\n}\n\nexport { Button, buttonVariants }\n",
      "type": "registry:ui"
    }
  ],
  "categories": [
    "overrides"
  ]
}