{
  "$schema": "https://ui.shadcn.com/schema/registry-item.json",
  "name": "button",
  "type": "registry:ui",
  "title": "Button",
  "description": "Button component built on Base UI",
  "dependencies": [
    "@base-ui/react/button",
    "class-variance-authority",
    "clsx",
    "tailwind-merge"
  ],
  "registryDependencies": [],
  "files": [
    {
      "path": "registry/uxio/overrides-button-base/button.tsx",
      "content": "import { Button as ButtonPrimitive } from \"@base-ui/react/button\"\nimport { cva, type VariantProps } from \"class-variance-authority\"\n\nimport { cn } from \"@/lib/utils\"\n\nconst buttonVariants = cva(\n  \"focus-visible:border-ring focus-visible:ring-ring/50 aria-invalid:ring-destructive/20 dark:aria-invalid:ring-destructive/40 aria-invalid:border-destructive dark:aria-invalid:border-destructive/50 rounded-lg border border-transparent bg-clip-padding text-sm font-medium focus-visible:ring-3 aria-invalid:ring-3 active:translate-y-px group/button inline-flex shrink-0 items-center justify-center whitespace-nowrap transition-all outline-none select-none disabled:pointer-events-none disabled:opacity-50 [&_svg]:pointer-events-none [&_svg]:shrink-0 [&_svg:not([class*='size-'])]:size-4\",\n  {\n    variants: {\n      variant: {\n        default: \"bg-primary text-primary-foreground [a]:hover:bg-primary/80\",\n        outline: \"border-border bg-background hover:bg-muted hover:text-foreground dark:bg-input/30 dark:border-input dark:hover:bg-input/50 aria-expanded:bg-muted aria-expanded:text-foreground\",\n        secondary: \"bg-secondary text-secondary-foreground hover:bg-secondary/80 aria-expanded:bg-secondary aria-expanded:text-secondary-foreground\",\n        ghost: \"hover:bg-muted hover:text-foreground dark:hover:bg-muted/50 aria-expanded:bg-muted aria-expanded:text-foreground\",\n        destructive: \"bg-destructive/10 hover:bg-destructive/20 focus-visible:ring-destructive/20 dark:focus-visible:ring-destructive/40 dark:bg-destructive/20 text-destructive focus-visible:border-destructive/40 dark:hover:bg-destructive/30\",\n        link: \"text-primary underline-offset-4 hover:underline\",\n      },\n      size: {\n        default: \"h-8 gap-1.5 px-2.5 has-data-[icon=inline-end]:pr-2 has-data-[icon=inline-start]:pl-2\",\n        xs: \"h-6 gap-1 rounded-[min(var(--radius-md),10px)] px-2 text-xs in-data-[slot=button-group]:rounded-lg has-data-[icon=inline-end]:pr-1.5 has-data-[icon=inline-start]:pl-1.5 [&_svg:not([class*='size-'])]:size-3\",\n        sm: \"h-7 gap-1 rounded-[min(var(--radius-md),12px)] px-2.5 text-[0.8rem] in-data-[slot=button-group]:rounded-lg has-data-[icon=inline-end]:pr-1.5 has-data-[icon=inline-start]:pl-1.5 [&_svg:not([class*='size-'])]:size-3.5\",\n        lg: \"h-9 gap-1.5 px-2.5 has-data-[icon=inline-end]:pr-3 has-data-[icon=inline-start]:pl-3\",\n        icon: \"size-8\",\n        \"icon-xs\": \"size-6 rounded-[min(var(--radius-md),10px)] in-data-[slot=button-group]:rounded-lg [&_svg:not([class*='size-'])]:size-3\",\n        \"icon-sm\": \"size-7 rounded-[min(var(--radius-md),12px)] in-data-[slot=button-group]:rounded-lg\",\n        \"icon-lg\": \"size-9\",\n      },\n    },\n    defaultVariants: {\n      variant: \"default\",\n      size: \"default\",\n    },\n  },\n)\n\nfunction Button({\n  className,\n  variant = \"default\",\n  size = \"default\",\n  ...props\n}: ButtonPrimitive.Props & VariantProps<typeof buttonVariants>) {\n  return (\n    <ButtonPrimitive\n      data-slot=\"button\"\n      className={cn(buttonVariants({ variant, size, className }))}\n      {...props}\n    />\n  )\n}\n\nexport { Button, buttonVariants }\n",
      "type": "registry:ui"
    }
  ],
  "categories": [
    "overrides"
  ]
}